{
  "schema": "campfire.resource-lease/v1",
  "resource_key": "steam-account:acct_demo",
  "mode": "exclusive",
  "generation": 3,
  "fencing_token": "aaaaaaaaaaaaaaaaaaaaaaaaaaaaaaaaaaaaaaaaaaaaaaaaaaaaaaaaaaaaaaaa",
  "owner_run_id": "run_demo",
  "owner_work_id": "work_demo",
  "expires_at": "2026-08-18T16:01:00Z"
}
